,Emotion,Sentence
314,Fear,"nhỏ thấy qua 1 lần , nó bị cột ngay trước cửa nhà người ta ở trong hẻm , mỗi lần đi ngang qua là nó lại định lao tới cà khịa"
1287,Enjoyment,cười ị :v
1466,Sadness,bởi vì gặp nhau sai thời điểm nên tôi mất người mãi mãi ...
587,Sadness,gia đình thì không còn . tình yêu thì chưa có gì chắc chắn . 😏
83,Other,"chỉ cần bạn dùng tình yêu thương , sự chân thành của mình đối với nó thì không gì là không thể ."
770,Disgust,disme tao chưa thấy con họa mi nào hót dở như con này luôn á .🤔🤔
824,Enjoyment,"muốn em vui vẻ đơn giản lắm , chỉ cần bao ăn bao xem phim tuần 1 lần thôi hỡi các đồng nghiệp ơiii 🤣"
643,Enjoyment,hay ý nghĩa sâu sắc 🙂
1474,Disgust,trẻ trâu quá đông và nguy hiểm
293,Other,chắc chắn là vị mặn của mồ hôi
433,Other,mày uống trà sữa thôi . đéo ăn gì nữa =))
114,Other,tất cả cùng không tính điểm . thế là xong :v
713,Other,nó cũng làm thế với bao người khác đấy
1336,Sadness,quay vào ô mất lượt :))
607,Other,"mình đã xem rất nhiều video như này rồi , nên thấy cũng bình thường =)))"
163,Fear,"sợ nhất mấy đứa ảo tưởng sức mạnh , nhắn tin nhiều chút là auto mình thích nó"
226,Fear,chắc từ giờ tao đéo giám ho nữa quá .
74,Disgust,đm mưa đâu đéo thấy . nóng vãi
89,Fear,per không cho anh đi tập đâu nha mất bồ như chơi
1046,Enjoyment,đối với thế giới này bà lão chỉ là một ai đó . nhưng đối với ông lão đó bà lão là cả thế giới 😊
923,Other,"per haha nhiều tiền quá mang đây tao tiêu hộ cho , đóng thuế 10 củ phí quá =))"
875,Sadness,"trời đụ , tội bé"
1669,Disgust,có lưu luyến thì lưu luyến người mình thích chứ lưu luyến gì cái trường đấy 😶
85,Disgust,"đụ mẹ tục , cuối tuần về ra nha :))"
803,Sadness,nốt hôm nay thui . thui không ngĩ đến và bắt đầu từ bỏ 1 thói quen
1447,Enjoyment,uiii xinh gái thế ...
1103,Disgust,chạy 200tr là vào biên chế ngay . thực trạng chung . cần gì có chuyên môn hay không
526,Anger,vì đồng tiền mà chúng mày giết bao nhiêu gia đình . chúng mày ăn những đồng tiền đấy mà chúng mày cũng nuốt trôi được à . bọn khốn nạn
415,Anger,cảm ơn các anh chị báo chí phóng viên đã đưa tin . mong cơ quan chức năng hãy làm thật nghiêm . thật mạnh tay vụ này . đến khổ mấy đứa nhỏ . mưa rét thế này . càng nghĩ càng tức .
783,Sadness,c trai như thế nào tuyệt chủng rồi :)
1614,Sadness,per ngóng cuộc đấu tranh công nghệ này . tq đồng lòng ghê nhỉ
433,Sadness,nước mình chả í thức gì cả xả rác bừa bãi để trôi rác đầy đường thể này thật buồn
1815,Disgust,nhờn :)))
244,Enjoyment,"năm nay mua cân na về nhà ăn dần , tối ra đường xem chúng nó dẫn vợ thằng khác đi chơi ... kaka"
777,Disgust,tiền bồi thường lấy ở đâu ? cứ làm bừa làm ẩu rồi lấy tiền của dân mà đền đề nghị sửa lại nếu ai làm sai thì bỏ tiền túi ra mà đền
393,Fear,điềm báo gì đây
1114,Enjoyment,siêu phẩm để đời .
1742,Enjoyment,tao phải công nhận là nó giỏi vãi . từ đứa diễn đến đứa quay và edit video .. giỏi vãi 🤣
1334,Enjoyment,per trai hay gái thì vẫn thấy tữn như thường kk
416,Other,động lực cho tôi tiếp tục .
1677,Enjoyment,"thôi bảo em gái xuống ngủ với mẹ đi , còn em percó sợ ma không ? thì ngủ với anh . hehe"
543,Other,đã nuôi thì nên chăm sóc bé cẩn thận ??
496,Sadness,quê vải mà chưa được ăn quả nào . huhu
1398,Sadness,"mới đây thôi mà đa 3 năm rồi , những ngày chia tay buồn đó :(("
1930,Disgust,"ý thức đéo gì đâu , từ già đến trẻ luôn 😥"
876,Other,"tao cũng vậy , mấy cái thiệp chúc noel thời cấp 2 trẻ trâu của lũ bạn vẫn còn nguyên xi"
771,Enjoyment,per haha . đặt bánh thì đặt thành cặp nhé . haha .😂😂
891,Disgust,thể loại này next sớm đi em
979,Disgust,làm chung với con mẹ ngáo là phải chuyển đi liền :) per ngọc kiều dung
336,Other,per ta nguyện nằm im
567,Other,thôi nhà đang yên ổn
1616,Disgust,"chưa học cách kiếm tiền đã học thói đi lừa tiền =,= thua"
911,Enjoyment,t tin crush của tao không bị thịt vì tao đéo crush ai cả =))
1086,Disgust,con mẹ kia có vấn đề về thần kinh :) không cần biết ai đúng ai sai nhưng đéo lịch sự thì đã đéo có tư cách nói chuyện rồi :) con bà kia xem được video chắc buồn làm
1167,Enjoyment,ai chưa xem thì nên xem 1 lần đi . đảm bảo không phí 3h đồng hồ của các bạn 😃
364,Enjoyment,chơi cái kiểu này nè :)) per
884,Disgust,đéo mẹ . nhìn nổi da gà ..
1068,Sadness,đó là một câu chuyện buồn
182,Other,cười trước nỗi đau của người khác
797,Other,có ai biết 2 người này không ạ ?
1763,Enjoyment,per coi đoạn con chó chết cười luôn em :))
505,Other,chủ tịch lén lút dùng đồ của vợ làm vlog và cái kết ?
151,Enjoyment,chúc mừng anh 👏👏👏 chúc anh may mắn . cố lênnnnn 💪💪💪
939,Enjoyment,phê thật . cái tai nó đang thâm đen xì lấy ra hết lại trắng hồng luôn
555,Anger,do cái áo . mặc giống nhau làm đíuu gì
1375,Disgust,tội còn nặng hơn cả khẩu nghiệp nữa 😌😌😌
30,Enjoyment,hồi xưa anh hay bị chửi trẻ trâu này nọ ... giờ anh là tổng giám đốc rồi 😁😎
177,Disgust,nv thu nhâ ̣ p cao thi ̀ hu ́ tao ma ́ u ngươ ̀ i dân phi ́ cao hơn hê ́ tao .
556,Sadness,người tài như vậy lại không được sử dụng đúng mục đích … quá buồn
1903,Disgust,một câu chuyện cổ tích xiaolon đầy tính nhân văn !!!
757,Sadness,còn chả có ai nói chuyện thân thiết quan tâm đến tôi :<
342,Enjoyment,đoạn phỏng vấn + xin đi chụp hình + cạo râu lão là hay nhất theo mình =]]
1854,Enjoyment,coi thôi cũng đủ nghiện rồi 💋
676,Sadness,năm nào cũng phải ở nhà trông nhà :((
136,Enjoyment,idol có skill mới chất quá 😂 1 cú đánh mông thôi mà đối thủ bay sấp mặt luôn luôn 🤣
1009,Disgust,"hy vọng cơ quan điều tra làm rõ được danh tính người phụ nữ , chỉ vì cái miệng mà làm tan nát cả 1 gia đình"
1634,Disgust,tấu hài cực mạnh
1843,Anger,con đĩ mất dại . trời đánh tránh bữa ăn nha con ml
1843,Enjoyment,cười xĩu
1517,Sadness,mẹ nó chứ xem xong mình khóc hết cả nước mắt
1759,Disgust,có tiền chưa mà đòi
1142,Disgust,"một hình ảnh hay nhưng một loại âm thanh rất chối tai , câu đầu tiên đã chửi thể và tiếp theo cũng vậy , rất vô văn hóa ."
471,Sadness,mình chụp mấy lần liền chả thấy bác sĩ cho mặc lớp áo gì cả 😭😭😭
1200,Disgust,thề đi ngoài đường giờ nhiều người lớn cứ nghĩ mình mình già rồi thích đi như nào thì đi . xong quay sang chửi bọn thanh niên là đi đứng mất dạy này nọ . chán . mang tiếng người lớn mà cư xử chán đcđ .
416,Sadness,trường gửi điểm về và mẹ cũng điện chửi :(
778,Other,ngày nay bã đã thay cho thính :)))
137,Other,thế sao tao hát tệ thế này
937,Disgust,còn đồng nghiệp hãm lờ thì ...
1011,Disgust,"nếu nói chị thảo tham thì chưa thoả đáng , vì ngay cả con chị cũng được niêm yết , định giá để “ chia chác ” ý kiến cá nhân mình , chỉ chia phần của chị và phần % của những người con sẽ được nhận vào 18 tuổi"
1052,Enjoyment,chỉ cần 1 cây hoa . nói lên tất cả .. hi
1154,Disgust,ngày xưa đi học văn và toán chắc noa dưới trung bình hết
639,Disgust,t lên facebook không phải để coi mấy cái thứ này 😪
520,Enjoyment,dễ thương quá à ????????
538,Sadness,làm khách đi qua lại mắc mệt lun
514,Other,trả lại tuổi thơ cho tao 😆
1787,Anger,để con mẹ mày tiếng bình thường nghe cho dễ . lại còn làm đéo đéo
177,Enjoyment,chỗ tao cũng có cây tình yêu < 3
351,Other,ngày nào cũng bị tụi siêu thị hành không dưới 10 lần
1900,Disgust,qua câu chuyện này mong mọi người đừng có cái nhìn ác cảm về các anh csgt về việc hay núp lùm bắt xe nữa mà còn nghệ thuật ăn nói kể chuyện xạolin đẳng cấp 🙂🙂🙂
897,Disgust,việc nhỏ như vậy mà hai con này hàng sử thiếu văn hóa quá quá
1190,Enjoyment,thỉnh thoảng lại xem lại phim này quá hay và ý nghĩa
1191,Disgust,"lúc đầu tưởng con ma , nó đi tẩy trang xong hiện nguyên hình đếu phải ma mà là con quỷ cái"
717,Sadness,2 đg thẳng mãi mãi song song không bao giờ cắt nhau hix hix
858,Other,mai chơi trò hứng nước mà nóng quá chắc chơi vầy luôn
1254,Sadness,per chơi với con trai riết nên giờ đéo có người yêu nổi vì tính tình không khác gì con trai
141,Fear,đm chơi mất dạy vãi . tưởng khúc cuối là gì dume làm giật mình 😒😒😒
1888,Disgust,"các bạn trẻ thấy cái gì cũng có mặt : giờ trái đất có , thử thách nhặt rác có , vứt rác bừa bãi có . toàn thấy các trẻ ( trâu ) tham gia ."
8,Fear,chạy ngay đi 😱😱😱 sợ quá .
37,Fear,"😔 tao không lấy chồng nữa , ở nhà nấu cơm cho mẹ , tao sợ lắm"
34,Enjoyment,"bữa tao coi cái video này nhưng nó ghép nhạc bựa vãi ... mỗi lần mỗi anh té là first blood , double kill ,... các kiểu =))))"
914,Enjoyment,chính xác ! chỉ cần đồng nghiệp tốt thì mọi ngày đi làm đều vui 😊😊😊
401,Enjoyment,đơn giản nha .. cơm này ngon hơn cơm điện nhiều . không tin thì cứ thử
728,Disgust,làm công thì chấp nhận . chỉ trách khách không ý tứ chứ quyền gì cấm nó đem mấy cái này vào ... có trách thì trách bản thân không có khả năng làm việc khác ngoài làm nhân viên vệ sinh
1763,Surprise,per anh tập gym cho to để như thế nào ư : )))
201,Other,nhìn cái đống lúa phơi mưa ướt nhẹp ma ghép cười được .
826,Enjoyment,đã sáng suốt hơn năm ngoái nhiều . ka ka
505,Anger,vậy nếu mình lên cơn điên và giết người khác thì nỗi đau gấp bội phải không ?
588,Anger,lòng đường là để giao thông chứ để nhà các bác đỗ xe à ?
549,Sadness,mình không áo mưa rồi 😞
642,Other,giọng không nhìn màn hình tao tưởng là ông bà già nào trên 60 tuổi đang nói á .
606,Sadness,nhưng nói thì cứ bảo hay than thở 😢
1425,Disgust,xiaolin không có gì vui . chúng ta không nên xiaolin 🙄🙄
1529,Sadness,còn tao mỗi lần cắt tóc là y như rằng … nó tệ vãi :(
901,Enjoyment,được . đỡ tốn 5 nghìn
329,Enjoyment,"replay chục lần đoạn cuối , phê quá"
1267,Enjoyment,đáng yêu quá ! tình yêu ông bà thật đẹp !
325,Fear,đứng tim luôn
1262,Sadness,vì bạn chỉ là con trai nắng hoặc em gái mưa thô :(
1225,Sadness,đau nếu còn nghĩ về nhau thì hãy quay về bên nhau :))
783,Other,nhấp mẹ miếng da chính giữa 2 lỗ rồi lấy muỗng múc là xong
17,Other,tư cách của người hành nghề
1559,Disgust,đéo bít sợ là gì đến lúc chết lại đổ cho tại số
606,Enjoyment,chỉ mong thương nhau đến đầu bạc răng long . vậy là đủ 👌
949,Other,khi gặp được người đem lại cảm giác bình yên mà từ trước đến giờ chưa từng có .
793,Other,"bên đó cậu sao rồi , có hay cười nữa không ?"
830,Disgust,"con gái ăn nói kiểu gì vậy trời , mình rất ghét con gái nói tục chữi thề"
125,Disgust,"suốt ngày sân si , chia bè phái bốc phốt nhau mà khi nghe chia lớp theo tn - xh lại bảo buồn"
1102,Enjoyment,"thú vui mới , thay vì chọc chó thì ghẹo ngỗng cho nó dí =))))"
1249,Sadness,có lẽ vậy là tốt nhất
865,Sadness,tận cùng của nỗi đau 😑😑😑
184,Disgust,chị dâu thì vãi rồi
758,Enjoyment,nhờ mất bạn nên mình mới biết 😂😂😂😂
323,Other,con quan rồi lại thành quan . chỉ dân mãi là kẻ bần hàn
389,Fear,kinh khủng
671,Enjoyment,cưng quá mà
1511,Anger,xiên chết cụ nó đi
102,Other,khi nào nha anh sẽ lắp hả per
1202,Enjoyment,cưng vãi ấy
57,Enjoyment,lớp chúng mình rất rất vui anh em ta chan hòa tình thân =)))
4,Fear,tinh trùng của người ngoài hành tinh thật đáng sợ 👏🏻👏🏻👏🏻
1343,Sadness,tội em vợ thế :(
1899,Surprise,ơ hoá ra là em à :(( lâu quá không gặp
234,Other,ko nên nhé các cụ .... hãy cho họ 1 cơ hội ... hãy nhìn sự việc từ nhiều khía cạnh khác nhau
1091,Sadness,bắt ve cho nó điiii . trông khổ quá
1337,Disgust,hic . nhiều khi thấy bả ngu thiệc chứ kp đùa 😂
1491,Enjoyment,rất chuẩn hãy sống làm người cơn luôn luôn co hiểu thảo với cha mẹ của mình nhé moi người ơi
919,Other,sao không ghé quán rồi nhờ người nhà cầm nón qua cho :))) tự làm khó mình vậy
1720,Enjoyment,con xe thần thánh . chạy hơn 50 năm chưa nát =)))
808,Other,có người yêu thì vẫn ăn bánh trung thu nhé . bánh trung thu là thứ tồn tại duy nhất . có em hay không không quan trọng
611,Sadness,đã từng . hix
1932,Enjoyment,chắc là năm lớp 4 5 gì đó :)) tao mua bánh kẹo đem vô lớp bán lẻ lại ... mỗi lần đem bán như vậy chắc cũng kiếm được lãi 2 - 30k 😂
1027,Disgust,có cái con cặc .. chúng mày chỉ diễn thôi đúng không . dume chỉ diễn thôi .. :'(
983,Enjoyment,nháy mắt cũng đáng yêu kkkk
652,Other,nghĩ cũng tội mà thôi cũng kệ
1482,Disgust,trẻ trâu chấp nó làm gì
194,Other,bắc sơn lạng sơn đang cháy khô rồi mưa cái gì chứ 😠
210,Enjoyment,per chị ơi còn học được cả tiếng anh nữa luôn này :v hịn quá
1912,Anger,"cổ nhân có câu : thương cho roi , cho vọt - ghét cho ngọt cho bùi . muốn con trở thành người tốt , nhưng gv nghiêm khắc thì lại phản đối . thật không thể hiểu nổi ."
740,Enjoyment,biết nấu cơm bếp củi từ lớp 2_3 gì đó
1023,Sadness,dạ đây là chị gái em nha không phải chồng đâu ạ người trong hình là em huhu ?
1744,Enjoyment,giỏi thật chứ đùa . biểu cảm gần như 90 % chuẩn mẹ rồi . thằng quay và edit cũng ghê luôn . nhảy cũng tốt ra phét chứ -.- ác thật
121,Fear,không cẩn thận phát là ngậm bả như chơi
1786,Disgust,có thịt bò nướng là ngon rồi bày đặt kiến đốt
1004,Other,"không có sức hút thì tao vẫn cắt , mùa hè để tóc dài nóng thấy mẹ"
1638,Disgust,bạn có phải óc chó không ? chắc bạn không trả lời được đâu nhỉ . óc chó mà =)))
834,Disgust,"móng tay dài như vậy thì làm gì để sống phục vụ bản thân cũng khó khăn uổng phí hết tuổi trẻ một đời người để nuôi một bộ móng , thay vào đó làm việc gì có ích cho bản thân gia đình và xã hội , đời người ngắn ngủi nên trân trọng thời gian quý báu của mình"
1939,Surprise,chỉ ăn 1 miếng thịt mà phải đốt chết thêm nhiều sinh mạng bé nhỏ nữa hả
821,Other,có đứa nào nấu cơm rồi nấu luôn cái bếp như tao không
171,Enjoyment,"đếu thể đỡ được "" tiền mừng , tiền mừng "" hahaha"
1072,Disgust,hãm lol nhưng thật lòng chứ còn hơn cứ tỏ ra trưởng thành mà bên trong thì như đồ bỏ đi
717,Other,per nghe có vẻ hợp lí nhỉ ?
1167,Other,ngoài ra thì nó còn bị mang tiếng là thả thính cả xã hội nữa
1764,Disgust,"từ nhỏ đến lớn chỉ nghe được câu mày béo thế , mày nên giảm cân đi chứ không ai nói rằng mày gầy lắm ăn nhiều lên 😆😆"
733,Sadness,cơ mà tao bị thần kinh thật
59,Anger,kiện chết mẹ mấy con súc vật đó đi
591,Other,sắm về hỏi mấy thứ :v
159,Disgust,cứ bảo ngon lắm với chả ngon vừa . không biết nghĩ trước khi ăn à
702,Other,con này là con lợn hay con gấu hay con ong vậy ????
815,Other,tại mình thử hết rồi :)) nên cậu nói thế thì mình bình luận thôi :))
39,Enjoyment,thề cứ 1 lần trượt là tao cười to hơn 😆😆
701,Disgust,mặt nạ chứ không phải mặt lạ nhé . ngọng thế mà cũng lấy được vợ ????
842,Enjoyment,per nhờ mất bạn nên mình mới biết 😂😂😂😂
1340,Enjoyment,thứ ba mẹ cho con và con nhận thấy đó là sự đức hạnh tấm lòng cao cả cam on ba mẹ rất nhìu
1651,Disgust,nhìn mặt thấy hãm buồi rồi .
675,Enjoyment,hãy nên trân trọng những người bạn như vậy .
1010,Other,nhớ bộ phim thằng gù nhà thờ đức bà không ?
1591,Sadness,bây giờ nhìn vào cứ kiện tụng mà nãn :((
1612,Surprise,thiết kế tinh tế quá
1095,Sadness,tớ cũng muốn có mối tình như vậy ??
1858,Enjoyment,một bộ phim quá suất sắc
481,Anger,suốt ngày bị chửi ??
1909,Surprise,mình không hiểu tại sao nó không bị phóng điện chết nhỉ ?
886,Sadness,vì tao hay bị chúng nó chọc nên thấy buồn
660,Enjoyment,một bình luận của người trong cuộc . đọc xong thấy ấm lòng cho per !
1875,Disgust,chó nhà tao mới đi lạc 3 hôm thôi mà quên mẹ hết chủ rồi :vậy
51,Anger,"có hình ảnh rõ ràng kiện chúng nó tội quấy rối đi . mịe cái lũ khốn kiếp , hay ho lắm cái trò dơ bẩn 🤧🤧🤧"
1854,Surprise,nhà nó giàu vãi
944,Other,per quả lừa con chó ngoài bờ rào
1609,Surprise,wow đỉnh quá
454,Other,ước gì tao thất tình cũng được giống như mày
1639,Surprise,"cái kết thật bất ngờ , không thể đoán được vậy"
1878,Enjoyment,per nhìn mặt cưng gê
169,Other,là đứa quay video
163,Other,cái lò xô ngày xưa ma
778,Other,một chuyến du lịch vui vẻ
731,Enjoyment,😔😔 hành động nhỏ v thôi thì cũng ấm lòng rồi ... nói thôi cũng vuii rồi ... 😝😝
1393,Sadness,"chúng ta những tháng ngày sau đó vẫn gặp nhau , vẫn nói chuyện nhưng không phải những cô cậu của hồi c3 nữa . chúng ta đều khác"
708,Enjoyment,bé gái đáng yêuc quá :))). dth nữa
1943,Disgust,cho khỏi đá ở việt nam . gì mà căng
905,Disgust,hình thức này .. là chúng nó đang huỷ hoại mầm mống tương lai của đất nước đấy
1275,Sadness,trông tội quá
666,Other,"hai con ma đấu đầu , con mũ đen ăn toàn cứt nên đanh hơn ?"
447,Other,"nó mừng kiểu nhảy vồ lên dơ đồ thôi , chứ dòng này gặp ai cũng mừng"
590,Anger,per ghét ghê bây
1391,Sadness,"học chán phèo , chả có gì đáng nhớ"
158,Anger,"tao cảnh cáo , page mà đăng mấy video kiểu ngôn lù thế này tao unlike , trả per trả cụ lầy , trả anh thai cho tao"
1042,Other,chắc làm theo yêu cầu
212,Enjoyment,"coi 3 lần mà vẫn cười , phim hay nhân vật dễ thương"
1596,Sadness,per sự thích thể hiện của các bạn mà bóng đá per tốn một món tiền không nhỏ ! 😩🙏🤕
971,Disgust,"mất nhân tính ( tiền không phải tất cả , nhưng làm tất cả vì tiền )"
1521,Enjoyment,thớt là gu của tôi :))) yêu quá hiuhiu
927,Sadness,muộn rồi :)))
922,Enjoyment,thề lun anh ấy rất kĩ thuật lun á
1749,Enjoyment,per có sub rồi nè . má coi đi coi lại vẫn mắc cười . với đưa anh stk đi
967,Enjoyment,bt mà tao vẫn lạng lách ở đây suốt
996,Enjoyment,chỉ mong có người đến cuối đời vẫn yêu mình như ngày đầu tiên ❤
1755,Enjoyment,anh thíck kiểu tra tấn hằng ngày :)))
786,Other,tuổi thơ với nó đấy
1771,Surprise,vợ chồng nhà này mặc quần áo ngủ đôi à ??
277,Enjoyment,buồn cười nhất cái đoạn cã lũ bạn đồng thanh * chó nó lấy * 😂
424,Anger,"đúng rồi còn quay quay , lớ nga lớ ngớ xuống trách người ta . có phải bãi xe tự phát đâu mà người ta dám làm láo ."
1055,Disgust,dăm ba cái yêu đương vớ vẩn :))
748,Other,ủa tao đang coi cái gì v 😂
119,Other,tàn nhang là xác định nhá ??????
1796,Disgust,sao toàn gặp hãm không àh . gần nhất là thằng âm binh nhất
1031,Other,phe áo vàng thích điều này
534,Other,có khi giờ tỉnh rồi đéo dám xuống nữa
1235,Enjoyment,lại đến giờ giải trí rồi mềnh ơiiii per =)))))
823,Other,vừa xung điện tim xong ra ngoài bác sĩ lắc đầu =)) cả nhà tao đưa bác sĩ vô nằm kế tao
1364,Disgust,thói ích kỷ
1579,Disgust,thứ học sinh mất dạy =))
572,Anger,má tự dưng bị đánh vào đầu :(
1109,Enjoyment,mong ông bà nhiều sức khoẻ . đáng yêu thực sự 😍😍😍
1821,Disgust,nhìn gai vãi
1597,Disgust,đọc thôi cũng mệt
513,Sadness,có những ngày mọi thứ nó bỗng ập đến
785,Disgust,per thề :))) cười cơ mà tao nghĩ nó cũng đéo ổn tí nào đâu
1207,Sadness,chỉ khổ các con thôi !! sao người ta lại có thể mất nhân tính như vậy
1010,Enjoyment,cute vậyyyyy
645,Other,thế rồi cha lái xe có giả tiền không các bác
1362,Sadness,nàng ấy chả yêu ta gì cả
469,Sadness,1 năm không biết bao nhiêu lần x - quang :(
653,Fear,thôi xong tao rồi :((
1411,Enjoyment,chỉ cần nhìn họ thì đã thấy tim đập mạnh rồi =)))
241,Disgust,phú thọ tởm quá
1620,Surprise,smart phone thành cục gạch là có thật luôn hả ??
1455,Enjoyment,"3 idiots , bộ phim rất đáng xem"
1441,Sadness,nói gì thì tụi bây cũng không tin đâu ..😌😌
295,Other,per nhà mình cũng có nè
380,Other,bây giờ lại chơi trò đánh tư sản mại bản như ngày xưa đi nhể
1297,Sadness,anh đánh mất thật rồi
1748,Anger,đậu xanh tao giỡn mặt với mày hả
1130,Disgust,những cái đáng làm không làm những cái không đáng làm thì làm cho tới
662,Sadness,hình như sau boss bị chết ạ
654,Other,xong tao đưa mày uống nha
199,Enjoyment,may mà không mua laptop này không thì ăn lìn lâu rồi :(
1195,Sadness,nếu chịu khó đặt vào hoàn cảnh của nhau mà sống thì mọi chuyện đã đơn giản hơn rồi .
557,Anger,đéo đùa :))
689,Other,nhìn hình vẽ khẩu trang lại tưởng 1 con mắt =))))))))
753,Enjoyment,có đứa nào đéo giật mình như tao không :)))
135,Anger,"băng băng cái lol , chưa đóng vào mặt nhau là may rồi"
720,Sadness,"ôi mệt quá , một ngày buồn tẻ"
2,Fear,bố đi đường mà sợ quá
1431,Anger,bác sĩ mất dạy
116,Fear,disss giật hết cả mình .:))
1281,Sadness,có lẽ vì vậy nên moi thứ trở nên thật khó khăn lúc này :(((
16,Enjoyment,bà đã được sống 1 kiếp người hạnh phúc . mấy ai có được điều đó . ngưỡng mộ tình yêu ông dành cho bà .
1315,Enjoyment,sau khi có vợ anh per đã có đồ giả gái xinh và tinh tế hơn 😆
851,Enjoyment,"per đi coi với tao , phim này hay nhất định phải coi"
432,Enjoyment,đứng trước mặt nó tụt quần ra auto hết giận
1374,Enjoyment,haha đây là cổng chợ này ??
1640,Enjoyment,giống y con bạn tao :))) mặc dù nó không phải gvien hay gì cả nhưng nó khá trẻ trâu
665,Enjoyment,nói chuyện yêuu thế đmaaaa ??
1741,Enjoyment,dễ thương ghê . thằng quay phim cũng không phải dạng vừa ^^
47,Other,yên tâm đi ông trời không bất công với ai đâu
631,Sadness,ko biết crush bây giờ có ở nhà không nữa 😭😭😭😭
394,Enjoyment,là khi lạc giữa 1 biển người hôm khai giảng nhưng vẫn nhìn thấy người đó rõ nhất
452,Anger,đồ điên . quét đéo được thì lấy máy hút bụi hút mẹ hết đi . hét hét cái lol gì =)))
1073,Enjoyment,"hay ta , hay ta"
1539,Sadness,anh ấy không thương tao
1162,Other,mặc cái váy thì phải cạp lông lách chứ :)))
866,Sadness,nhìn lũ trẻ yêu nhau mà lòng già xao xuyến
570,Other,ai đã dùng nó bây giờ phải 50 tuổi rồi
1222,Enjoyment,"1 đoạn phim được trích ra tuy ngắn nhưng , chứa 1 thông điệp rất có tầm quan trọng"
419,Enjoyment,quan trọng là đỉnh ^.
1399,Enjoyment,đem người đó ra biển cho biển cuốn đi lun .. hihii
608,Anger,"hàng loạt các sai phạm , vi phạm diễn ra nhưng bộ giáo dục chưa đưa ra được biện pháp nào có hiệu quả chấm dứt các sự việc tiếp tục xảy ra"
